{
  "$schema":"https://json-schema.org/draft/2020-12/schema","$id":"https://coh.invalid/contracts/splunk-parser/v1/splunk-parser-audit.schema.json","title":"COH Splunk parser redacted audit","type":"object","additionalProperties":false,
  "required":["schema_version","contract_version","event","outcome","reason_codes","query_id","actor_id","scope_digest","query_digest","plan_digest","registry_digest","parser_receipt_digest","policy_decision_digest","audit_reservation_digest","native_text_exposed","literal_exposed","credential_exposed","vendor_body_exposed","sid_exposed"],
  "properties":{"schema_version":{"const":"coh.splunk-parser-audit/v1"},"contract_version":{"const":"1.0.0"},"event":{"type":"string"},"outcome":{"enum":["accepted","denied","revoked"]},"reason_codes":{"type":"array","maxItems":64,"uniqueItems":true,"items":{"type":"string"}},"query_id":{"$ref":"#/$defs/id"},"actor_id":{"$ref":"#/$defs/id"},"scope_digest":{"$ref":"#/$defs/digest"},"query_digest":{"$ref":"#/$defs/digest"},"plan_digest":{"$ref":"#/$defs/digest"},"registry_digest":{"$ref":"#/$defs/digest"},"parser_receipt_digest":{"$ref":"#/$defs/digest"},"policy_decision_digest":{"$ref":"#/$defs/digest"},"audit_reservation_digest":{"$ref":"#/$defs/digest"},"native_text_exposed":{"const":false},"literal_exposed":{"const":false},"credential_exposed":{"const":false},"vendor_body_exposed":{"const":false},"sid_exposed":{"const":false}},
  "$defs":{"id":{"type":"string","pattern":"^[0-9a-f-]{36}$"},"digest":{"type":"string","pattern":"^sha256:[0-9a-f]{64}$"}}
}
