{
  "schema_version": "coh.splunk-parser-audit/v1",
  "contract_version": "1.0.0",
  "event": "splunk_parser_decision",
  "outcome": "accepted",
  "reason_codes": [],
  "query_id": "018f0000-0000-7000-8000-000000000001",
  "actor_id": "018f0000-0000-7000-8000-000000000002",
  "scope_digest": "sha256:2000000000000000000000000000000000000000000000000000000000000001",
  "query_digest": "sha256:2000000000000000000000000000000000000000000000000000000000000002",
  "plan_digest": "sha256:2000000000000000000000000000000000000000000000000000000000000003",
  "registry_digest": "sha256:2000000000000000000000000000000000000000000000000000000000000004",
  "parser_receipt_digest": "sha256:2000000000000000000000000000000000000000000000000000000000000005",
  "policy_decision_digest": "sha256:2000000000000000000000000000000000000000000000000000000000000006",
  "audit_reservation_digest": "sha256:2000000000000000000000000000000000000000000000000000000000000007",
  "native_text_exposed": false,
  "literal_exposed": false,
  "credential_exposed": false,
  "vendor_body_exposed": false,
  "sid_exposed": false
}
